[
    {
        "source_id": 1561,
        "file": "files/1561/AdobeStock_459465972-scaled.jpeg",
        "filename": "AdobeStock_459465972-scaled.jpeg",
        "mime_type": "image/jpeg",
        "title": "cybersecurity concept, internet security, screen with padlock",
        "alt": "",
        "caption": "cybersecurity concept, internet security, screen with padlock",
        "parent": 1496,
        "url": "https://kme.test/wp-content/uploads/2024/10/AdobeStock_459465972-scaled.jpeg",
        "filesize": 288017,
        "sha256": "ee03e8bd5e275e6d0642257d8a96d374487e33b627c21b1a478b5d389440f829",
        "missing": false
    }
]
